alec doolan,5 years ago,5,"Good food, mixed clientele, TV bit too loud but not too bad once we moved tables. Staff behind bar prob friendliest I have ever encountered, went here before watching a band at Manchester Academy will defo be going again",9,No photos count,False,0,,Not found,Not rated,Not rated,Not rated,Not found
Josephine Cook,5 years ago,4,"Very busy as last Sunday before Christmas , ordered meals and through app just a little slow with delivery of hot drinks. Which had cooled down by the time we received them.",107,51,True,0,,Not found,Not rated,Not rated,Not rated,Not found
Matt B,10 months ago,4,Always good choice of beers. Great staff,191,211,True,0,,Not found,Not rated,Not rated,Not rated,Not found
Ibrahim,6 years ago,4,"In the heart of Manchester City Centre and usually busy, a little wait to find a free table. To be fair the staff are friendly but nothing different to other Wetherspoons, very crowded. Value for your money on the food and drink.",391,1889,True,0,,Not found,Not rated,Not rated,Not rated,Not found
Rob Gough,4 years ago,4,"As with all Wetherspoon pubs now, buy one mug and get lots of whatever hot drink you want.
Service was quick and pleasant, and the bonus of some interesting local history on the walls - if you're into that.
A pleasant way to start a leisurely day.",115,193,True,0,,Not found,Not rated,Not rated,Not rated,Not found
james drinkwater,6 years ago,4,"It's a weatherspoons. You know what to expect! Cheap beer, food is good, but not the best. Place is a little dark and dingy, little bit sticky as well. Can't argue though. Nice staff and everything you'd expect if your after a pint at 10:45am on a Monday!! Lol. Good starter/meeting place for your nights out.",25,4,True,0,,Not found,Not rated,Not rated,Not rated,Not found
ben jones,4 years ago,4,"Rare 4 star review, nothing wrong with the place, food or drinks and the staff are always great it's always busy and a bit of a rough crowd. To be expected given the location.",137,147,True,0,,Not found,Not rated,Not rated,Not rated,Not found
Anthony Gallagher,4 years ago,4,Ordering from the app to your table worked flawlessly,2,1,False,1,https://lh5.googleusercontent.com/p/AF1QipO-udCOAzqWIqixzCoLmdOnvcek91Y72A5UWYWy=w900-h675-p-k-no,Not found,Not rated,Not rated,Not rated,Not found
Nathan Spillane,9 months ago,3,Decent pub in Manchester.  I think you can do better but works when you have kids with you.,24,2,True,0,,Not found,Not rated,Not rated,Not rated,Not found
Michael Nash,a year ago,5,"Good value for money. Great location
Food served daily. Ideal to watch sports",85,712,True,0,,Not found,Not rated,Not rated,Not rated,Not found
Jess,4 years ago,2,"What a strange place. Went in with my toddler who was in a pushchair to have some lunch with my sis and was refused one alcoholic drink without ordering food. I ordered food (3 share plates for £12 for me and my toddler) and still wasn't allowed a beer as it wasn't classed as a full meal. Very odd, the sis however did order a full meal and was allowed one drink. I'd think twice before going here again.",69,1451,True,0,,Not found,Not rated,Not rated,Not rated,Not found
Vasant Jambavdekar,a year ago,5,Awesome Food... Lightning Quick Service.... Superb Atmosphere...,84,10,True,0,,Not found,Not rated,Not rated,Not rated,Not found
Beyond Help,5 years ago,3,"Food is good, not very happy that for some food offers, if you're not careful with pricing can be overcharged and that's sneaky. However good atmosphere most of the time.",26,2,True,0,,Not found,Not rated,Not rated,Not rated,Not found
Vivianne Watson,a year ago,4,"Nice place but there was a incident in there at 11.30 in the morning, apparently it happens all the time",7,1,False,0,,Not found,Not rated,Not rated,Not rated,Not found
C T,a year ago,3,It's a spoons . Bit rough. And don't expect friendly staff . The other spoons in the city are far better and with friendlier staff.,132,122,True,0,,Not found,Not rated,Not rated,Not rated,Not found
Belinda Donlon,4 years ago,4,Go for the pizza 🍕 very good. Very busy so had to wait for table then for it to be cleaned. But great for being able to chat and linger …,61,9,True,0,,Not found,Not rated,Not rated,Not rated,Not found
Stephen Lee,a year ago,5,Great place staff nice and friendly loads of different beers to choose from and good for food can be busy but worth a visit and not far from the train station,349,429,True,0,,Not found,Not rated,Not rated,Not rated,Not found
Andrew Aitken,a year ago,5,Had a drink there Saturday night and breakfast Sunday morning. Friendly staff and I liked the location opposite Piccadilly Gardens.,5,No photos count,False,0,,Not found,Not rated,Not rated,Not rated,Not found
Simon Hall,2 years ago,4,Really good vibe in here but always busy. Not the place to be if you like it quiet,33,29,True,0,,Not found,Not rated,Not rated,Not rated,Not found
John Levell,a year ago,5,Busy pub but great for meeting up with a large group on a stag do,279,591,True,0,,Not found,Not rated,Not rated,Not rated,Not found
David Heywood,3 years ago,1,Very poor the worst wetherspoon pub it hss been my misfortune to visit. Ordered a traditional breakfast and when served the underside of the egg resembled a leather sole the hash browns looked as though they were from the day before reheated the bacon looked positively anemic on the plus side the sausage ok,2,No photos count,False,0,,Not found,Not rated,Not rated,Not rated,Not found
Janet Deakin,a year ago,3,"A little dark,like most Wetherspoons. Drinks are a bargain as always. Staff pleasant.",163,158,True,0,,Not found,Not rated,Not rated,Not rated,Not found
Angela Giddins,3 years ago,1,"We called at Wetherspoons Piccadilly Manchester for a cooked breakfast. What we got had been cooked but a long time before it was served to us. The food served ranged from just warm to cold. We told two members of staff before we got a replaced cold breakfast.
There are obviously no checks made on the food temperatures being sent out to unsuspecting customers.
We will certainly consider other places before returning to Wetherspoons",353,55,True,0,,Not found,Not rated,Not rated,Not rated,Not found
Mark Rollins,11 months ago,4,Nice staff good beer always pop in for a pint when I'm in Manchester,147,5,True,0,,Not found,Not rated,Not rated,Not rated,Not found
Mark Simpson,4 years ago,1,"I wasn't allow to order drinks without ordering food because I had my 14 year old daughter with me,we had been shopping and called on the way back to the station . We enjoyed pizza Express ,much better surroundings . Thank you",27,No photos count,False,0,,Not found,Not rated,Not rated,Not rated,Not found
John Celestus,9 months ago,3,This place is always super loud and food takes forever to arrive,109,55,True,0,,Not found,Not rated,Not rated,Not rated,Not found
Danny Brownbill,6 years ago,2,"Slow service, obnoxious staff with blantent ignorance. Generally just an unpleasent environment. There was also a strange smell lurking so we left abruptly. Its a shame as the pub itself is impressive!",62,76,True,0,,Not found,Not rated,Not rated,Not rated,Not found
Stuart Hayward,5 years ago,4,"Good breakfast, even nicer beer! Bar staff seemed more interested in cleaning than serving though.....it would have been nice to have been acknowledged when the bar was empty.......",8,6,False,0,,Not found,Not rated,Not rated,Not rated,Not found
Andrew Martin,3 years ago,3,"The lights are not all level, tinsel is 1970s and made me sad. All the chairs and tables should be the same, amateur really. Also the lighting at the back of the pub was inconsistent and I needed a miners helmit. The waiter threw garlic and herb at my friend and now he is garlic intolerant. Fruit machine flashes too much, which may cause a seizure. The toilets smell like a hippo had diarrhoea in there.",24,No photos count,False,0,,Not found,Not rated,Not rated,Not rated,Not found
Retro Records,5 years ago,1,"Doesn't allow swaps for breakfasts like other weatherspoons. Poor form from the manager. Also why don't you get beans that have no animal products for the vegan breakfast. Dry full English? Come on, that's horrible. Don't make things you wouldn't eat yourself",4,No photos count,False,0,,Not found,Not rated,Not rated,Not rated,Not found
David McCaw,a year ago,4,As always a great place to go for an inexpensive breakfast and coffee,97,263,True,0,,Not found,Not rated,Not rated,Not rated,Not found
Angela Smith,a year ago,4,Great breakfast and drinks. Excellent value for money.,99,530,True,0,,Not found,Not rated,Not rated,Not rated,Not found
Juan Diego Gómez,6 years ago,4,"The place is nice but yesterday a drunk guy harrased us at 9AM. Not cool.

One waitress asked the drunk guy to change his seat so that was helpful.",54,27,True,0,,Not found,Not rated,Not rated,Not rated,Not found
Clive Goodwin,5 years ago,4,"Very lively pub, especially on a Saturday afternoon. It was solid. Could hardly move in it, but that shows how popular it is. Good cheap beer and good food, right in the heart of Manchester city centre.",88,566,True,0,,Not found,Not rated,Not rated,Not rated,Not found
Jon “Siggy” Sigsworth,a year ago,5,Great 👍 food and service 👌...a little more lighting would 👌 be good in the rear.. …,229,No photos count,False,0,,Not found,Not rated,Not rated,Not rated,Not found
Andy Hogg,4 years ago,1,"When back in Manchester for a visit recently we tried to get a drink but the whole bar service thing was total chaos,there was what seemed like enough staff but no organisation, waited about ten minutes and were what seemed like next in line then the bar person decided to move to a different area and serve someone else. A member of staff with a badge on saying team leader was faffing about,and twizzing about completely unaware of anything. Will not return.",21,No photos count,False,0,,Not found,Not rated,Not rated,Not rated,Not found
Kev D999,5 years ago,3,"I'm a big fan of Spoons but I found this one to be more at the lower end of the spectrum. They do a fabulous job of renovating old buildings but this one is a basic oblong in a typical 'classic pub' style and, to be honest, it could probably do with a facelift. Not one of their best.",77,722,False,0,,Not found,Not rated,Not rated,Not rated,Not found
Rob Geraghty,6 years ago,3,"Good value, long wait on food when it wasn't too busy. Food was nice but very small portions. Friendly staff",49,51,True,0,,Not found,Not rated,Not rated,Not rated,Not found
John Berry,3 years ago,4,This was a typical JDW. Great food at great prices -friendly staff and repeat coffee. What more can you say. Guarantee a good visit every time in any place.,74,108,False,0,,Not found,Not rated,Not rated,Not rated,Not found
Glenn Porter,a year ago,1,It was rubbish. Delivered wrong order and when my food did arrive it was stone cold awful,12,No photos count,False,0,,Not found,Not rated,Not rated,Not rated,Not found
Steven Smith,4 years ago,4,Good menu cheap and cheerful great customer service and helpful staff when asked about local amenities. Ladies toilets were a bit of a hike but gents were ok standard.,11,14,False,0,,Not found,Not rated,Not rated,Not rated,Not found
Lee-Ann A,9 years ago,3,"Called in as needed something to eat assuming that as a Weatherspoons food would be great....  I would say it was ok,  nothing special.

New staff,  with what appeared to be little training.  Overcharged and order came out wrong.  Did get refund but had to wait an age to get it.

Was surprised how many people just walked in, used toliet and walk back out,  although they were very clean considering

Won't be rushing back",43,No photos count,False,0,,Not found,Not rated,Not rated,Not rated,Not found
NICK “NIKGOLFER” NISBET,4 years ago,5,I love Wetherspoons super cheap food supercheap beer and is all good as well,266,310,True,1,https://lh5.googleusercontent.com/p/AF1QipOjqHQoLcclgUDj75qB6ty4LrQf2B2qLYifCpUU=w900-h675-p-k-no,Not found,Not rated,Not rated,Not rated,Not found
Chris Harris,6 years ago,5,"You can always rely on a Wetherspoons for a great meal, selection of real ales and friendly staff.",44,109,True,1,https://lh5.googleusercontent.com/p/AF1QipNeqPSiSNKKzaplKj6rYPZozFl1IbCAXuaqmKHw=w900-h675-p-k-no,Not found,Not rated,Not rated,Not rated,Not found
James Gibson,11 months ago,3,"Very busy, staff did well, but worst weatherproon toilets in the UK and Ireland",33,No photos count,False,0,,Not found,Not rated,Not rated,Not rated,Not found
Chris Parker-Brads,9 years ago,3,"It is okay. The beer is cheap. The decor is average, but it is on Piccadily. It needs a refurb and bringing up to date as you literally feel like you enter a time machine back to 1990's and not in the good way.",253,826,True,0,,Not found,Not rated,Not rated,Not rated,Not found
Maria Lamb,4 years ago,3,Not one of our favourite spoonies. We left after one drink. It didn't smell very nice when we walked in. It was Saturday afternoon and it was very noisy.,90,315,False,0,,Not found,Not rated,Not rated,Not rated,Not found
Geraldine Denton,11 months ago,5,Good food quick service.fair price,91,75,True,0,,Not found,Not rated,Not rated,Not rated,Not found
John Hilbert,a year ago,5,Great place for meeting up good pub food & choice of drinks helpful staff lots of room & good distanceing wheelchair friendly nice toilets.,173,362,True,0,,Not found,Not rated,Not rated,Not rated,Not found
Steve Roberts,2 years ago,5,Great value for money and well trained staff. Cheap and cheerful. We frequent W'spoons wherever we go. Always reliable.,280,No photos count,True,0,,Not found,Not rated,Not rated,Not rated,Not found
Jordan Wright,4 years ago,4,"Typical spoons prices, the few times I've visited (midweek afternoon & Sunday morning) it has been very busy however the service is relatively fast and staff are friendly. But it's not the most appealing interior of all the wetherspoons I've been to.",46,12,True,0,,Not found,Not rated,Not rated,Not rated,Not found
Ian Vesty,a year ago,4,"Huge place all on one floor very busy but usual food and drink but nice and clean,",160,69,False,0,,Not found,Not rated,Not rated,Not rated,Not found
julie lydon,a year ago,3,Very busy and a bit short staffed. Had to wait to get served for 10 minutes 😩 …,160,No photos count,False,0,,Not found,Not rated,Not rated,Not rated,Not found
Lynne,4 years ago,5,"Very nice. Good food, reasonable prices. Lots of people, so you know it's good.",47,32,False,0,,Not found,Not rated,Not rated,Not rated,Not found
Chris McClain,9 months ago,5,Good food cheap beer I recommend,40,577,True,2,"https://lh5.googleusercontent.com/p/AF1QipNWekSveOMZ8E7o_lnUEm_loeNUI2CViyS74mXm=w450-h675-p-k-no,https://lh5.googleusercontent.com/p/AF1QipONPv6LeUjMbIKeLVDT_gf1PgUR1_QkujZItS-Y=w450-h675-p-k-no",Not found,Not rated,Not rated,Not rated,Not found
DEEBEE 360 Films,3 months ago,5,Great place right on Piccadilly Gardens,61,No photos count,False,0,,£1–10,Not rated,Not rated,Not rated,Not found
ian whillock,6 years ago,1,"Uninterested bar staff had to point out the beer I wanted --- twice. Food arrived barely hot cold under the air con. Generally off the pace for a Wetherspoons.  Come on Tim sort it out
Won't be here again. Makes coalville like premium  night out",6,No photos count,False,0,,Not found,Not rated,Not rated,Not rated,Not found
sheila lawrence,a year ago,5,Yeh lovely drinks came very quick and the food did after using the app,438,No photos count,True,0,,Not found,Not rated,Not rated,Not rated,Not found
Gal Majik,2 years ago,4,"Good food, well priced, quickly served, good selection. A firm choice of many people",47,No photos count,False,0,,Not found,Not rated,Not rated,Not rated,Not found
Deepika Chhajer,4 years ago,4,"Everything I had at this place was tasty. The only issue I had was with the Vegan breakfast. Otherwise the place, the range of alcoholic and non-alcoholic beverages and the food was amazing.",11,25,True,0,,Not found,Not rated,Not rated,Not rated,Not found
Shelly Hutson,4 years ago,4,"Busy but good, staff were lovely and very efficient. Food was delicious and great value for money would definitely go again",23,1,True,0,,Not found,Not rated,Not rated,Not rated,Not found
Stan Marsh,a year ago,5,Good food at a reasonable price. Good place to start off your visit.,20,14,False,0,,Not found,Not rated,Not rated,Not rated,Not found
Simon Hyde,9 months ago,4,"Usual Wetherspoons. Great prices, good mix and nice atmosphere. Would visit again.",59,33,False,0,,Not found,Not rated,Not rated,Not rated,Not found
Luke Proctor,5 years ago,2,"Wetherspoons is cheerfully cheap. Low prices do attract the grislier characters in society, though. Food is sub-par; the quality of food you'd expect to see on Death Row. If you're hungry, desperate for food or a quick, cheap drink - it might be worth a visit, but it's a place to avoid after 6pm when the less savoury clientele rush through the doors.",187,5,True,0,,Not found,Not rated,Not rated,Not rated,Not found
yijun liu,4 years ago,4,"Is a typical pub, with drinks and food. Breakfast. The price is not bad, and is nice place to catch up if you and friends like to drink. But is usually aim for older people",37,7,True,0,,Not found,Not rated,Not rated,Not rated,Not found
Jenny Drayton,a year ago,5,"Lovely food, not too dear,a bit busy though.",25,No photos count,False,0,,Not found,Not rated,Not rated,Not rated,Not found
Diane Rudd,6 years ago,2,"Had a fresh fruit and Greek yogurt breakfast.Very disappointed with it. It was basically apple, banana and a blob of yogurt on the top with four blueberries as decoration!  I expected maybe some strawberries or pear or melon maybe??.",79,353,False,0,,Not found,Not rated,Not rated,Not rated,Not found
Paul Burke,a year ago,5,Great place for a bit of liquid refreshment and a quick bite.,438,534,True,0,,Not found,Not rated,Not rated,Not rated,Not found
Jon Smith,a year ago,5,Great place cheap drinks and food. Staff very attentive. Great pub around.,222,204,True,0,,Not found,Not rated,Not rated,Not rated,Not found
D B,a year ago,4,"Cheap food, you get what you pay for. Pizzas looked really nice and fresh",52,5,True,0,,Not found,Not rated,Not rated,Not rated,Not found
John Drewett,8 months ago,4,"Staff, food, drink all good.",71,No photos count,False,0,,Not found,Not rated,Not rated,Not rated,Not found
Gill Hurst,11 months ago,4,Was very busy but still managed great service,78,161,True,0,,Not found,Not rated,Not rated,Not rated,Not found
Neil Scholes,4 years ago,3,"Not the best westherspoons I have been too there place looked dirty, tables were a mess, bar staff were slow and got orders wrong, it was busy so that could always have factored into these issues. Food for a westherspoons took a long time after been told a 15 minute wait it was more towards 30 minutes.",192,273,True,0,,Not found,Not rated,Not rated,Not rated,Not found
Debra Grosse,4 years ago,3,"Average,  had to send scampi back as it was burnt. Change it for me no problem.  By then my husband was already finished his food",47,9,True,0,,Not found,Not rated,Not rated,Not rated,Not found
Ben,7 years ago,3,Good value for a big plate of reasonable quality pub food and drinks. Tables/menus could do with a good clean. Pub is quite dark inside.,263,1321,True,0,,Not found,Not rated,Not rated,Not rated,Not found
Susan Walsh,11 months ago,2,It was a long time to get any hot drinks the machine was not working.,28,No photos count,False,0,,Not found,Not rated,Not rated,Not rated,Not found
Donna Ireland,4 years ago,4,"Big pub just nearby the bus stops and tram station and not far from Piccadilly train station. Opens for breakfast and often stop here as a meeting place for a coffee or glass of something stronger when I meet up with my friends.
Food is usual Wetherspoons fare and prices are competitive
Especially like the unlimited coffee or tea which is great value at £1.49?
Only downside is it can get really busy and be difficult to find a table.",34,27,True,0,,Not found,Not rated,Not rated,Not rated,Not found
Sam Foster,4 years ago,4,"Good old spoons, decent for a drink. Usually busy but good prices and plenty spaces for a seat. Can't complain",26,519,True,0,,Not found,Not rated,Not rated,Not rated,Not found
Mandy Chaffer,2 years ago,3,Usually a good visit but place was under staffed. Poor girl behind bar was run off her feet. 😕 …,161,No photos count,False,0,,Not found,Not rated,Not rated,Not rated,Not found
Ben Smudo,4 years ago,5,Great to order by App and pay with PayPal;-),40,46,True,1,https://lh5.googleusercontent.com/p/AF1QipNJ_eapMfYoscHSJdgCETza9lea7S9LRG8t73VV=w900-h675-p-k-no,Not found,Not rated,Not rated,Not rated,Not found
Vin B,5 years ago,1,"Places such as this should be shut down. I went to meet a friend, and as I entered I was shocked by a post-apocalyptic sight: scenes of human degradation beyond the imaginable. This is one of those chain pubs that sell very cheap booze and thus attracts the type of crowd that wants to spend entire afternoons/evenings, getting more miserable than they mormally are, and spending as little as possible. It represents the tragedy of the capitalist world where individuals are deemed able to choose and fend for themselves. This place proves the opposite. Sad, very sad.",19,6,True,0,,Not found,Not rated,Not rated,Not rated,Not found
stephen Williams,7 months ago,1,Only good thing about this Wetherspoons is they sell Asphalt cider,52,5,False,0,,Not found,Not rated,Not rated,Not rated,Not found
Shannon Smith,4 years ago,5,"Good food, good and fast service for 4pm. Not too busy but definitely more tables full than empty",21,8,True,0,,Not found,Not rated,Not rated,Not rated,Not found
Tom P,11 months ago,5,"Lovely pub, great atmosphere and very reasonably priced.",38,15,True,0,,Not found,Not rated,Not rated,Not rated,Not found
Lee Crapper,a year ago,1,Rubber over cooked food and service to match...just like any other Wetherspoons to be fair...I don't think anyone from management ever eat in thier own because if they did I think a lot would change.,35,1,True,0,,Not found,Not rated,Not rated,Not rated,Not found
Martyn Slater,a year ago,5,Great staff. Impressed that tables were cleared and cleaned quicker than most.,360,1116,True,0,,Not found,Not rated,Not rated,Not rated,Not found
Rob Carroll,a year ago,4,Clean. Friendly helpful staff. Food and drink at low prices. Fast service.,49,17,True,0,,Not found,Not rated,Not rated,Not rated,Not found
Linda Fairclough,5 years ago,4,"Always guaranteed a a great meal for reasonable prices. The drinks are well priced too, pitchers of cocktails etc. Lots of different guns. Xx",137,52,True,0,,Not found,Not rated,Not rated,Not rated,Not found
Sean Smyth,7 years ago,2,"it was curry thursday. ordered a korma with extra chicken tikka pieces, a large balti and a skinny chicken burger.  had cold korma meal and extras.  samosa was frozen in the middle. bar staff offered a complimentary drink.  I refused and got a full refund as not only is the food nasty to eat, itis also dangerous. hopefully the other food is above value ready meal standard, but I wont be visiting again unless I want an alcoholic drink.",35,26,True,0,,Not found,Not rated,Not rated,Not rated,Not found
Franklin Chilaka,a year ago,5,Nice steak. Handles quite a crowd!!! Food came on time.,82,40,True,0,,Not found,Not rated,Not rated,Not rated,Not found
Derek Hanvey,5 years ago,3,It was late on a Saturday night when we went in here and the place was buzzing. The drinks were reasonably priced and the staff served us quite quickly.,82,17,True,0,,Not found,Not rated,Not rated,Not rated,Not found
Sarah-jayne Legat,a year ago,5,Really nice food. And great atmosphere. Will return again,84,186,True,0,,Not found,Not rated,Not rated,Not rated,Not found
Gwen Hayes,3 years ago,2,"Christmas Eve, went in for food. The pub was so dirty. Floor dirty tables really dirty. Bar staff so over worked. In the end we left without having either food or drinks. Sad really as not usually like this and staff trying so hard",33,2,False,0,,Not found,Not rated,Not rated,Not rated,Not found
Danny Jenkins,a year ago,5,Good place for meal on the cheap in manchester put their beer up not normal weather spoons price still cheaper than pubs around,30,No photos count,False,0,,Not found,Not rated,Not rated,Not rated,Not found
Keir Briscoe,6 years ago,5,"I know this is a chain o pubs but everyone I have been in has ha great beer, good cheap beer, and a warm atmosphere with a wide mix of patrons. Great ace for an early evening pint and a laugh with your mates.",12,4,False,0,,Not found,Not rated,Not rated,Not rated,Not found
Jolene Jackson,2 years ago,1,Had food chucked at me and my friend and it also went in my drink and my friends and asked for a fresh drinks and then because I asked for well done meat they were bloody and then asked for the money back and we only got £8.26 back when we paid £21.90 it was a joke,5,No photos count,False,0,,Not found,Not rated,Not rated,Not rated,Not found
Mark Kitchen,10 months ago,5,"Nice place, went in for a breakfast was decent",45,No photos count,True,0,,Not found,Not rated,Not rated,Not rated,Not found
Iwan Roberts,5 years ago,4,"Visited for breakfast around 09:30 and as always a typical Wetherspoons, service good, friendly smiles from the staff. Value for money clean food but the plate a bit cold.",64,16,False,0,,Not found,Not rated,Not rated,Not rated,Not found
stephen robinson,a year ago,3,Cheap beer but some out of stock on the last visit.  Meals reasonable and well staffed.,98,25,True,0,,Not found,Not rated,Not rated,Not rated,Not found
