Reviewer Name,Review Date,Star Rating,Review Text,Total Reviews by Reviewer,Total Photos by Reviewer,Is Local Guide,Number of Images,Image URLs,Price per Person,Food Rating,Service Rating,Atmosphere Rating,Recommended Dishes
Jitka Brandejska,a month ago,5,"I visited this establishment to experience a ""full English breakfast"", I got a plate full of tasty food for an incredible friendly price. The unlimited coffee was good. The next day I got eggs Benedict. I liked it a lot. The staff was very friendly.",8,2,False,2,"https://lh5.googleusercontent.com/p/AF1QipNgBSVEZ23crLd7z2FHGzqulI2eAMdmtXdNkPey=w450-h675-p-k-no,https://lh5.googleusercontent.com/p/AF1QipOM7k0wyi00HMs9vvRcb4OLS4uzaO-xPm8OAg2l=w450-h675-p-k-no",£1–10,5,5,4,"Eggs Benedict, Traditional Breakfast"
Josh Baltazar,5 months ago,4,"Came here before one of the Manchester United games, this place was packed with fans.  Love the selection of beers supplied at Wetherspoons, quite traditional as well. I chose one of the Red Ale's to drink, I believe I ended up getting a Lancaster Red.  I only got a beer but the food looked great as well, saw a lot of Fish and Chips, definitely want to try the food here one day.",523,2340,True,2,"https://lh5.googleusercontent.com/p/AF1QipPhq1VgNFQrR_wJWrsaFBnJn_26Ev3kYLcHaX8A=w450-h675-p-k-no,https://lh5.googleusercontent.com/p/AF1QipOgFcZ4ri1KTiIvxPJPpo1AVISi6DgYZZpTtDR6=w450-h675-p-k-no",£1–10,Not rated,Not rated,Not rated,Not found
alan hypno,a month ago,5,Top beers low prices decent food the place was packed but service was fast,248,113,True,4,"https://lh5.googleusercontent.com/p/AF1QipPjjr6l5mgLOoojkswyHso_-h8ve7AvzpsXjOhI=w450-h338-p-k-no,https://lh5.googleusercontent.com/p/AF1QipO53-XQvozEuF6-mQlXRKvu7pbTMd3gI7PFZwXe=w450-h338-p-k-no,https://lh5.googleusercontent.com/p/AF1QipNUqRjKc8J-TKkccVmsmWySCKTs6Zm7i_7PFTnO=w450-h338-p-k-no,https://lh5.googleusercontent.com/p/AF1QipPPTcbS5tb8lrEkUln-6FoWHh0T_0m174y5yFIi=w450-h338-p-k-no",£10–20,5,5,5,English Breakfast Small
LTT_OFFICIAL,6 months ago,4,"Nice chicken wings.
Nice dip.
Nice pizza.
The staff is quite good.
The place is really overcrowded in the weekend evening.
The high chair is not quite comfortable.",227,830,True,3,"https://lh5.googleusercontent.com/p/AF1QipOtJx82s7vPBnTll7mbrxpR-RGLIN-HgpJdGmH4=w450-h675-p-k-no,https://lh5.googleusercontent.com/p/AF1QipMHaGRYbBUIBsYX2dC4ZzHB0nq8nWGPTKTxtC0r=w450-h338-p-k-no,https://lh5.googleusercontent.com/p/AF1QipNnwKOiSWj1thG-R1DU6bH1UJJO7HxEfvvjIrWL=w450-h338-p-k-no",Not found,Not rated,Not rated,Not rated,Not found
Misaki,7 months ago,4,"A wide spaced pub where you can eat and drink cheap, specially during the afternoon time (I've got a big plate of fish & chips and a pint under 10£). You have to order and pay for it through a QR code on the menu, so the waiters aren't interactive to you at all, bus I guess that's how this pub works. Overall it's a nice budget place to dine.",111,228,True,2,"https://lh5.googleusercontent.com/p/AF1QipNSon-vGkPw7gtVDlgZzaEuyP_fGqIQuMHN7A57=w450-h675-p-k-no,https://lh5.googleusercontent.com/p/AF1QipM4hFbw9_1WFBJXgJIx9U65dy4qAXX3zdGquzZ6=w450-h675-p-k-no",Not found,Not rated,Not rated,Not rated,Not found
Jason Phillip Shaw,3 months ago,4,Just had chicken strips and 5 wings. Two beers. Less than £20 so taken edge off appetite. Tad busy at 17:00 Saturday as people drinking before heading home. Good value. Better nibbles than expected.,5,No photos count,False,0,,£10–20,5,4,4,Wings
F. Antonio Campos Cardellat,3 months ago,1,"I ordered a Double American Cheese Burger with a extra 6 onion rings.
I got only 4 onion rings, the Burger was not warm enough, ridiculously small even smaller than normal burger and the bread was dry .... Fantastic experience.... Definitely won't come back here  ... Even McDonald's do better burgers ... So imagine the quality of this burger 🤮.",43,12,True,0,,£10–20,1,1,1,Not found
M R,4 days ago,2,"The only redeeming features are that it's centrally located and drink prices are cheap. Otherwise, it's a vast nondescript drinking lounge with a long bar counter and unenthusiastic inattentive service. There's an extensive menu for all tastes and cuisines. It's cheaper than Yates.",143,2095,True,0,,Not found,Not rated,2,2,Not found
Miriana Cecchi,10 months ago,5,"By suggestion of a friend who lives there, I've been here every morning to have breakfast during the days I spent in Manchester. Excellent quality at a very affordable price.
Traditional breakfast is so good and if you take a cappuccino (or a hot beverage) you can refill it how many times you prefer.
Thank you, Wetherspoons",2,13,False,3,"https://lh5.googleusercontent.com/p/AF1QipNnkOj3y6_I43hThBOG3fUqn3JsCfw-VHpXpua-=w450-h675-p-k-no,https://lh5.googleusercontent.com/p/AF1QipPggKVKOvT0P64vVbXH_OUBN_r3ePiOO1ZSEa_1=w450-h338-p-k-no,https://lh5.googleusercontent.com/p/AF1QipO09tnooVBi1zcM6E8KOH-a_dnxQAZKNbDHFLRk=w450-h338-p-k-no",Not found,Not rated,Not rated,Not rated,Not found
Chris Shimwell,3 days ago,5,It's a busy place but all the staff I dealt with were pleasant and efficient. Not the place for a quiet drink...but then you are on the main street going to Manchesters shopping centre. Vegan chilli was really tasty,3,No photos count,False,0,,Not found,4,5,5,Not found
Jo Preston,2 months ago,4,"Holly and the rest of the staff were lovely when another customer was inappropriate towards me. Me and my sister were out for a meal and a customer at the table next to us tried to touch my breasts, my sister complained and he was immediately escorted from the premises. Holly and the other staff consistently checked in with me and made sure I was ok while assuring me he would not be allowed back onto the premises. The food and drinks were great and I felt really taken care of",6,No photos count,False,0,,£20–30,5,5,3,"Spicy Chicken Wings, Chips"
Sue,a month ago,5,"Wetherspoons in Manchester offers a quintessential British pub experience that's both familiar and comforting. Whether you're a local looking for a relaxed evening or a traveler seeking a taste of British hospitality, this establishment has something to offer.

One of the standout features of Wetherspoons is its extensive and budget-friendly menu. From hearty breakfast options to classic pub fare like fish and chips, burgers, and curries, there's a wide variety of dishes to choose from. The affordability here makes it a popular choice for a casual meal or a quick bite with friends.

The pub's interior exudes a cozy and inviting atmosphere. The traditional décor, including wood-paneled walls and vintage artwork, adds to the charm. Whether you prefer a quiet corner to enjoy a pint or a lively spot to watch a sports match, Wetherspoons has the space to accommodate various preferences.

Speaking of pints, the drink selection is impressive, with a wide range of beers, ales, ciders, and cocktails on offer. The pub often features local and regional brews, allowing you to explore a taste of Manchester's beer culture.

Service at Wetherspoons is generally efficient, with staff ready to take your orders at the table or the bar. It's a no-frills approach that suits the relaxed pub environment.

One thing to keep in mind is that Wetherspoons can get quite busy during peak hours, and the noise level can rise accordingly. However, this adds to the vibrancy and social atmosphere, especially if you're looking to mingle with locals and fellow visitors.

In conclusion, Wetherspoons in Manchester provides a classic British pub experience with its affordable menu, cozy ambiance, and a wide range of drink options. Whether you're stopping by for a hearty meal, a few pints, or simply to soak in the local pub culture, it delivers a satisfying and enjoyable experience.",4,No photos count,False,0,,Not found,5,5,5,Not found
Jenny Baborak,3 months ago,4,Good food for good prices 👍😊 Refill coffee ☕ and tea 🍵 for just £1. We love to come back again and again 😊,26,52,True,1,https://lh5.googleusercontent.com/p/AF1QipNYaIBXAeWYSMwTAk2JCmzJ4HSbkldM7I_Nc0FN=w900-h675-p-k-no,£1–10,3,3,3,Not found
Trailblazer EHT,a year ago,5,"Lovely English hangout!!!
Franchise all over the UK that provide great restaurant vibe.

This particular outlet is a Lovely place to get fast food in the Manchester City Centre. It maintains the same quality as other Franchises all over the country.

I especially enjoyed the fish and chips which is a Legendary traditional English dinner/meal.

I had a lovely time hanging out with friend here the last time I visited Manchester. I hope to be here when next I'm in Manchester.",86,12365,True,3,"https://lh5.googleusercontent.com/p/AF1QipPaodrFgMiZG_FcXThy2Py4XmJtk3srpr2FmVeM=w450-h675-p-k-no,https://lh5.googleusercontent.com/p/AF1QipPgW4GtcDHJ-w9CvvjRj0fDXq2kQjN579Lo9b3i=w450-h338-p-k-no,https://lh5.googleusercontent.com/p/AF1QipNBTNVmy-9ABK8ZoNbwtophOVsRG2lWYfo3JoBu=w450-h338-p-k-no",Not found,Not rated,Not rated,Not rated,Not found
Frank Bowker,5 days ago,3,Had breakfast but took 25 minutes to come. Cold plate caused the food to be cold very quickly . Sausage and bacon dry and over cooked. Wetherspoons breakfasts vary so much between pubs,272,60,True,0,,£10–20,3,3,2,Not found
Claire Harrison,a month ago,2,"Once again I asked for half pint cider and they gave me a pint, of which I paid for because he already poured it. Do they pretend not to hear you properly when you order a half pint! It's happens every time I go in there. I ordered Ramon vegetarian noodle bowl, they were not Ramon noodles at all, it was long pasta spaghetti, that which you normally use for spaghetti bolagnaise.",8,No photos count,False,0,,£10–20,2,2,3,Not found
Luke Mcwilliam,3 months ago,5,"Went for food, crazy guy stole food off counter! 20 mins later went to bar, staff were so professional. Would like to suggest guy with funky shirt who dealt with situation and gave me a free beer to be promoted! Need more people in industry like him! As ex spoons worker he handled with professionalism and perfection!",2,No photos count,False,0,,Not found,5,5,5,Not found
John Ansell,3 months ago,3,"A nice bar and decent staff. It was clean, big and for once, the toilets were not a ten mile hike. What I did find annoying was at just after 11pm the security told us what time we had to be out by and then kept reminding us every few minutes.  I can tell the time and was trying to enjoy a pint with my wife. The constant interruption was not really appreciated. We were gone by 11.25. The bar staff are great  but your security need to step off the brakes a little",102,66,True,0,,Not found,Not rated,4,3,Not found
Henry Iroagalachi,5 months ago,4,"It was the first pub I visited in Picadilly, the ambience was interesting and the local brew I had was great. I also enjoyed watching my Pal playing the roulette on the machine where he lost some quid.",2,4,False,1,https://lh5.googleusercontent.com/p/AF1QipPyMvgn9jG7DUc9J6qvnl4DCOOJ5ZJ7FyXrKrr8=w900-h675-p-k-no,Not found,Not rated,Not rated,Not rated,Not found
Andrew Markwell,2 weeks ago,4,"Always busy, packed with stereotypical wetherspoons customers. Cheap 🍻 quick service. Didn't have any food. Cramped seating if in a wheelchair.",24,43,True,0,,Not found,Not rated,4,4,Not found
Swee Cheng Tan,5 months ago,5,"Had breakfasts there over 2 days...food was good, service was fast and efficient. Ordering through the QR code was so easy. Would like to commend George who was the duty manager there on 28 May for his outstanding service in handling a problem I had.",7,No photos count,False,0,,Not found,Not rated,Not rated,Not rated,Not found
Nigel Griffiths,3 months ago,4,Decent Spoons but they had no poached eggs...,812,7159,True,2,"https://lh5.googleusercontent.com/p/AF1QipOw5quSatuT6CUvSidWihGgB8_1N958MhZIELIS=w450-h675-p-k-no,https://lh5.googleusercontent.com/p/AF1QipP401tvSuhk_QolXVvvwj4TZlWUA8MsHaQCINhm=w450-h675-p-k-no",£1–10,4,5,4,Not found
Thomas Müthing (theviolinproject.de),a year ago,4,"This JDW pub is simply named ""Wetherspoons"", no catchy name  attached. It's right opposite of Piccadilly Gardens, and barely 10 minutes on foot from Piccadilly Station. A large ""Spoon"" with a simple layout: One big room, with a slightly elevated are usually reserved for people who also want to eat there - in fact you can eat anywhere as long as you can find a free table. And that can be rather tricky during peak times.
Speaking of food: While the dishes are the same at all the Wetherspoon pubs, prices vary between individual pubs (usually, the food is more expensive at metropolitan Spoons). There's always a rotating selection of inexpensive cask ales available, and generally every variety of alcoholic drinks imaginable - at the lowest prices in Britain. The interior of this particular Spoon isn't as grubby as some, but not as stylish as others. It's pretty much your middle-of-the-road, average JDW pub. If you're looking for a nicer cask ale pub, head down Portland Street, you'll find several - with more expensive and not necessarily better beers on tap. ;)",605,5234,True,3,"https://lh5.googleusercontent.com/p/AF1QipN1jRLwtyOgVd9cN2MkERAiKbuv5Sim4h90S5Hp=w450-h675-p-k-no,https://lh5.googleusercontent.com/p/AF1QipNqXSXLxlki3QSrS5VYh2VidWWHkCGnIAeDT93N=w450-h338-p-k-no,https://lh5.googleusercontent.com/p/AF1QipPdKwI_p_BEW_aBRFdOm89eq4B5guNT5V5xWXnR=w450-h338-p-k-no",Not found,Not rated,Not rated,Not rated,Not found
Jay Bowden,6 months ago,1,"It’s an overwhelmingly busy place so kind of pointless to visit if you’re on your own, took me forever to get served — but that wasn’t the staff’s fault, just an indication of how busy it is, and always seems to be",214,396,True,1,https://lh5.googleusercontent.com/p/AF1QipNVKEm8ds0FvTZv8aXEE20a90K7AT4MYQX_FSZU=w900-h675-p-k-no,Not found,Not rated,Not rated,Not rated,Not found
Auldreidy SunnyRocker,3 weeks ago,3,"It's a Wetherspoon's, need I say more? 😂

Okay, I will.

The bar staff were pleasant and patient while I procrastinated over the drinks order.

The pint of Old Peculier I got was obviously either start or end of barrel 😝

As usual, very busy and a little too hectic.

Didn't feel like I wanted to stay long.",15,6,False,0,,£10–20,Not rated,Not rated,Not rated,Not found
Terry Doherty,2 months ago,1,In wetherspoons ordered lemon chicken and Leffe drink and iced soda water. The water and leffe was excellent. Refreshing and top leffe flavour . Sadly the food was awful. The chicken was incinerated and chips overcooked. However I was hungry. Time was marching on and limited so I just tucked into the awful meal. Good atmosphere but awful food.,39,7,True,0,,£10–20,Not rated,Not rated,Not rated,Not found
Alessio Esposito,2 months ago,5,"Holy moly this was the best and finest dining experience I’ve ever had. The steak was cooked to perfection, it was so beautiful.

What made it better was the atmosphere, proper British.",2,No photos count,False,0,,Not found,5,5,5,Not found
Truman Lourdes,8 months ago,5,Fantastic atmosphere. Very friendly staff and great food. I'm never gonna miss this place every time I come over to Piccadilly,159,103,True,2,"https://lh5.googleusercontent.com/p/AF1QipNJV9y0KPwCFrrYbLkY9dCm32MJc3cYjbxRzL6A=w450-h675-p-k-no,https://lh5.googleusercontent.com/p/AF1QipO8R6q06wN3BY2aQbWhZTKZ19tSM3BcIYvX2JaY=w450-h675-p-k-no",Not found,Not rated,Not rated,Not rated,Not found
MARK DAVIES,a month ago,1,"Yesterday Breakfast , beans cold , H browns cold, sausages barely warm, bacon almost raw ( looked like it had been dipped in warm water for 10 secs) egg was OK / not as good as other spoons in the area.",21,No photos count,False,0,,£1–10,1,Not rated,Not rated,Not found
Trevi Yeung,a year ago,5,"Consistent Great Food at an affordable price, nice place to enjoy an afternoon",103,542,True,4,"https://lh5.googleusercontent.com/p/AF1QipPxxHk32WbHoIrxfeZuxhVoiBpKgbLZrZK5ZJLG=w450-h338-p-k-no,https://lh5.googleusercontent.com/p/AF1QipNV5KUJC9HQpdi9_ClTk1PP4VRzeKn1Y_zqKiqe=w450-h338-p-k-no,https://lh5.googleusercontent.com/p/AF1QipNjRxfNGmqSZjnGMRu1u1R5ES0hZXCdlIoM3jWl=w450-h338-p-k-no,https://lh5.googleusercontent.com/p/AF1QipM_qPcfak1zbfB5HYgiPZAabRL9xciwrqFo5ec1=w450-h338-p-k-no",Not found,Not rated,Not rated,Not rated,Not found
Lona K.,2 months ago,5,"We like Wetherspoons, as it is serving same food anywhere we go, this way we know that my son can eat safely most of the choices which are suitable for his Dietary needs.
The only downside is that some people kept vaping inside the restaurant side.",171,858,True,0,,£20–30,5,4,4,"Chicken Burger Menü, Chicken Tikka Masala"
Asif Ahmad,a month ago,5,"It's been a while since I've kept coming here and back, away from the students at the university. Sometimes, I'm getting busy as usual, but very much quiet.",18,338,False,0,,Not found,Not rated,Not rated,Not rated,Not found
Wendreth Mythania,5 months ago,5,"Love coming here after a shopping trip
They have an awesome allergy board where you pop in your dish and it tells you any allergens it might contain.

It's ideal as I'm lacto and gluten intolerant.

Staff are friendly and helpful.

Highly recommended.",178,267,True,0,,Not found,Not rated,Not rated,Not rated,Not found
steve mcfarlane,4 months ago,5,"It's a more modern plain pub, but nether the less it has the atmosphere of all wetherspoons. Staff friendly, food hood and did not gave to wait long. Using the Wetherspoons app means you do not have to leave your table for drinks or food.",167,281,True,0,,£10–20,5,5,5,Not found
William Nightingale,9 months ago,5,Visited just after the 8am opening time as was due to catch a train from the nearby Manchester Piccadilly Railway Station. I had a large breakfast with the addition of 2 slices of Black Pudding. I also ordered a bottomless hot drink. Service was quick and the food excellent.,189,94,True,1,https://lh5.googleusercontent.com/p/AF1QipP9aDKmXbGeVsPStl3zqJNIvAnDsV9rSSmPgjlJ=w900-h675-p-k-no,Not found,Not rated,Not rated,Not rated,Not found
Jonny “The Danger” Nield,a week ago,4,Cheap and cheerful as always!!,155,327,True,1,https://lh5.googleusercontent.com/p/AF1QipPPPKy1Ejf6QDhkkeFv9iUogsG2NcHWAOmewCVv=w900-h675-p-k-no,£10–20,5,5,4,Not found
Paul Baker,4 months ago,1,"Terrible !   ordered a traditional breakfast and coffee. Staff pleasant and polite . I then sat at the  table and the lady who had taken my order walked up and placed an empty china mug on my table and explained  where the  coffee machine  was .  My eyesight is not good and I therefore don't like using  coffee machines , and was not pre-advised of this , so I decide to forego the  coffee - it wasn't expensive -- some you win some you lose. But then breakfast arrived -- the  food was barely warm , bordering  on cold , and the  plate had not being pre-warmed to keep the  food hot . I went to the  bar to explain the  food was cold and  I would rather  expect  the  food to be hot .  Staff member was very pleasant and said she would get me another breakfast , and she walked over to my table to took the food away.   A few minutes later , second  breakfast arrived -- younger
staff member who looked like  he was still at  school  EXACTLY the  SAME !!  COLD FOOD I suspect the kitchen keeps  certain quantities of sausages , bacon , hash browns, beans etc already cooked and placed in "" kept warm""  containers .At this point  I was fuming and knowing that if I spoke to the staff I might become more than a bit annoyed ,  I decided to just leave the food on the  table  , got up and  left,  Absolutely  disgusted that they do  not  know  how  to  serve  hot food !     Wasted  £7.47
A few doors away , The  Piccadilly  Tavern -- much better quality  food and service ,  better  prices too.  Will never go to that  Wetherspoons  again",1,No photos count,False,0,,£1–10,1,3,3,Not found
Joe,2 months ago,1,"Literally the worse breakfast I’ve ever had. How can you mess up a full English so badly! All barely warm. Toast soggy, fried eggs broken and over cooked, bacon has a funny flavour, they should be embarrassed putting it out the kitchen. Wasn’t expecting gourmet cuisine but this was terrible, not worth the £7 and that’s hard to do! Hire a chef who can at least fry an egg!",5,3,False,0,,£1–10,1,2,3,Not found
Charlie Watson,5 months ago,1,"Visited on Friday night for a few drinks. The actual staff were friendly and helpful but the bouncers seemed to be on one, two of us initially arrived and were excessively quizzed over our driving licences, at 24 it was ridiculous to be suggesting I’m using a fake ID. Later they refusing to let one of our female friends in who arrived alone (and sober) as it was 30 mins before last orders - the bouncer was subsequently overruled by the bar manager. Jobsworth bouncers who just wanted to leave a young woman stand outside at Piccadilly Gardens. Weird.

It’s a spoons, cheap and cheerful, but I’d go to somewhere else as the bouncers are on a power trip.",29,6,True,0,,£20–30,Not rated,Not rated,Not rated,Not found
Norman Walsh,a month ago,5,"The food was nice, service is great, via the app, so no queuing up at the bar. Atmosphere was OK as it was during the day",30,7,True,0,,£20–30,4,5,4,Not found
Rebecca Goh,4 years ago,4,"Was recommended to try this place for the value of the food - couldnt agree more! A variety of options for reasonable prices and serving sizes that are not too overwhelming. Their hot chocolate is tasty, not overly sweet. Comforting in winter.",96,250,True,3,"https://lh5.googleusercontent.com/p/AF1QipNjJuWz326x-KW1IS87jvgcEMXZzIa-MZD2sC1R=w450-h675-p-k-no,https://lh5.googleusercontent.com/p/AF1QipNL4-fOJrkqcv-R3fsr4vgHrniiG2N-W1T_oJWY=w450-h338-p-k-no,https://lh5.googleusercontent.com/p/AF1QipMZCW8cfCudQNlD16PQww0P03IivvtK4wbGdqwZ=w450-h338-p-k-no",Not found,Not rated,Not rated,Not rated,Not found
Jane Stapleton,4 months ago,5,"Staff are very fast and professional and polite, the service was fantastic unfortunately food came too quick and bacon was raw in the  panini but as I told member staff, they took whole meal straight away and replaced with no problem  lovely and busy pub friendly and when visit Manchester again we will visit again!",30,No photos count,True,0,,£1–10,4,5,5,Not found
P.T. Black,a month ago,1,"Sticky bar, sticky tables, very rude staff, microwaved food... Now also overpriced. The toilets should have some more exact name, absolutely horrible",17,2,False,0,,£20–30,1,1,1,Not found
Ian Jackson,a month ago,3,Had a quick bite to eat and a few beers at the start of a night out. Very busy but service was quick.,49,No photos count,True,0,,£20–30,4,4,3,Not found
David Lowe,4 months ago,4,"I went into Wetherspoons Piccadilly Manchester twice last week. It was busy but not over packed. I noted a few table's full of empty plates, glasses etc. A young male staff member came over and immediately cleaned the all up,wiped down and put the chair's straight under the tables. Something very rarely done.
As the night progressed I noticed he was working non stop doing the same thing ,and also serving on. I managed to catch his eye and told him what a good job he was doing,and so refreshing to see. I asked him what his name was he told me George, and I think he is part of the management team. Very,very impressed with his tirelessly work.",48,34,True,0,,£50–60,4,5,5,"Fish and Chips Deal, Traditional Breakfast"
ejanke9,3 months ago,5,"Writing this just after I’ve left the Weatherspoons as I’m so impressed with the service I received from Employee Kiera.

Been to this weatherspoons multiple times with my gf and the atmosphere is always so chill and friendly, even if it is sometimes a bit busy.

With my gf being out of town she wanted to treat me to a dessert so ordered online using my table number. In the last mouthful of the ice cream I had there was a tiny thin sheet of what seemed like plastic in it, I can only assume from the ice cream tub or something similar that had chipped into it. I took it out of my mouth and set it aside to inform the staff, not really bothered as I’ve never had any issues before in my many visits.

As Kiera was going by I got her attention to inform her and let her know about the plastic but also let her know I’m not too bothered about it as I’d already eaten the full thing and it was in the last bite. Kiera showed amazing hospitality skills immediately acknowledging the issue and informing her manager straight away whilst apologising. I was then refunded for the dessert at the counter, my gf being the one who ordered online and not being present not being an issue as I had the order number, and was apologised to again.

I was so impressed with how she handled the issue and took control of the situation. Kiera is an absolute star and should be commended for her work!",2,No photos count,False,0,,Not found,5,5,5,Not found
Keith Evans,a week ago,4,Unfortunately the staff give you the food like they don't want to be working,105,396,True,1,https://lh5.googleusercontent.com/p/AF1QipPwgt32NmT9PRQUYsOCirFNK9CURnKDl-c3JqO7=w900-h675-p-k-no,£1–10,3,5,2,Not found
Sam White,3 months ago,3,"It's a spoons. Always gonna get dependable food at a slowly increasing price tag. If your hungry and on a budget or need pre drinks, boom!",157,20,True,0,,£20–30,5,5,2,Burger
